{
  "schema": "arcanea.visual_prompt_contract.v1",
  "intent": "Create an evidence-bound visual study of Avilara for the contracted deliverable.",
  "subject": {
    "stableId": "avilara",
    "displayName": "Avilara",
    "kind": "world",
    "identityLock": "Avilara is a warm coastal Realm where Fire and Flow meet at Solavila, a 200,000-person capital built in seven working tiers between the singing Cerro Luminoso and the bioluminescent Mar de Aurora. Coral-pink volcanic stone stays warm and translucent at its edges; dark-blue sea-cliff tile, harbor labor, dye vats, copper shops, inner courtyards, sky gardens, and stairs that hum underfoot form a Caracas-inspired but explicitly non-Earth civic system.",
    "evidenceState": "source-complete-review-required",
    "openIdentityVariables": [],
    "allowedVariation": "Weather, time of day, and viewpoint may vary; geography, ecology, architecture, labor, inhabitable scale, and material economy may not drift."
  },
  "storyBeat": "At first light, harbor crews unload the Caleta Roja catch while Tier Two artisans open dye vats and copper workshops; breakfast smoke climbs toward the singing stairs, and the Cerro, seven inhabited tiers, and Mar de Aurora remain in one plausible watershed instead of becoming a tropical fantasy postcard.",
  "composition": "16:9 inhabitable environmental plate with foreground work, midground social system, and distant ecological consequence; no empty establishing shot.",
  "output": {
    "assetCount": 1,
    "aspectRatio": "16:9",
    "intendedSurface": "world-dossier-and-environment-atlas",
    "deliveryRole": "world system identity candidate plate",
    "cropSafety": "Protect the foreground action and midground causal evidence inside the central field; distant context may not become the sole story carrier, and no alternate crop is authorized.",
    "generatedTextPolicy": "no-generated-text"
  },
  "designSystem": {
    "styleMode": "adaptive-primary-pending",
    "direction": "ADAPTIVE_STYLE_PRIMARY_PENDING_AFTER_ROUND_01",
    "colorLaw": "70% ecological/material neutral, 20% identity family, 8% active phenomenon, 2% relational accent.",
    "escalation": "resonant: one localized impossible behavior; environment remains physically legible",
    "materialLaw": "Tactile, specific materials with wear, weight, construction, and local environmental response.",
    "typography": "No text, letters, logos, watermarks, borders, captions, or pseudo-glyphs inside the generated image."
  },
  "light": "Motivated directional light plus one localized Arcanean working signal; preserve skin, material, and atmospheric truth.",
  "references": {
    "sourceRefs": [
      "book/las-tierras-de-luz/AVILARA.md [sha256:c0f9e35432b4020db97577a248d4f480516d7843196f53991c39662ce046694f]",
      "book/las-tierras-de-luz/BIBLE.md#sensitivity--inclusion-protocol [sha256:473f6b0c27438dea9652369d8b4c36c0305f77d3ec0b844f70d159ffbe3221dc]",
      "book/las-tierras-de-luz/chapters-en/01-avilara-cerro-luminoso.md [sha256:e4b75ffbf4c82ee346204e51e5e94efd55b70b8421d909bac9c4a082db1e970b]"
    ],
    "imageRefs": [],
    "imageReferencePolicy": "Use only owned or licensed references. Record file hash and role: identity, composition, material, or lighting. Never use a reference as permission to imitate its creator."
  },
  "constraints": [
    "grayscale silhouette remains identifiable",
    "perspective, inhabitable scale, ecology, architecture, labor, and material economy remain coherent",
    "visible phenomenon serves one story law",
    "adult premium editorial finish; no mascot energy",
    "foreground labor or maintained evidence, midground social system, and distant ecological consequence all derive from cited sources",
    "geography remains navigable and material economy remains physically plausible",
    "architecture, ecology, climate, labor, and active phenomenon belong to one causal world system"
  ],
  "avoid": [
    "generic fantasy concept art",
    "rainbow galaxy effects",
    "permanent flame crystal or waterfall hair",
    "franchise or living-artist style imitation",
    "appropriated sacred clothing symbols gestures or shrine architecture",
    "illegible pseudo-text",
    "sexualized or childlike treatment",
    "color as the only identity signal",
    "empty skyline postcard",
    "decorative fantasy megacity without food labor water waste transport or maintenance",
    "portal as the only evidence of a world",
    "monoculture represented by one costume one temple or one color"
  ],
  "provider": {
    "adapter": "runtime-discovered",
    "preferredCapabilities": [
      "high-fidelity reference input",
      "iterative editing",
      "consistent identity",
      "generation receipt"
    ],
    "model": null,
    "seed": null,
    "providerParameters": {}
  },
  "verification": {
    "deterministicChecks": [
      "declared aspect ratio within 1.5% provider-rounding tolerance",
      "file decodes",
      "no embedded prompt text",
      "receipt and output hash recorded"
    ],
    "rubric": "arcanea_visual_quality_v1_10x5",
    "passThreshold": 42,
    "identityFloor": 4,
    "canonFloor": 4,
    "humanApprovalRequired": true
  },
  "governance": {
    "releaseEligibility": "candidate-after-human-gates",
    "sensitivityReviewRequired": true,
    "reviewRequirements": [
      "A paid Venezuelan-Spanish woman reader with diaspora experience reviews architecture, food, labor, language-coded objects, and Caracas resonance before identity approval.",
      "Review confirms that Avilara remains an Arcanean Realm with its own material economy and does not use Indigenous Venezuelan dress, symbols, ritual objects, or sacred architecture as generic fantasy decoration."
    ]
  },
  "contractHash": "62ee1d7dc3e56af4848133a98c8a44cc82e61dcb8ef14249accdcfea9d40d0d0"
}
