{
  "schema": "arcanea.visual_prompt_contract.v1",
  "intent": "Create an evidence-bound visual study of Sable Luminaire for the contracted deliverable.",
  "subject": {
    "stableId": "sable-luminaire",
    "displayName": "Sable Luminaire",
    "kind": "book-character",
    "identityLock": "Sable is pale from life in aurora-crystal spires, five-foot-seven and slim, with extremely straight black hair arranged precisely over one shoulder and held back elsewhere. Her almost-colorless light-grey eyes are unnervingly still. Clothes, posture, and movement are deliberate. A small deep-indigo almost-closed circle marks the inside of her right wrist.",
    "evidenceState": "source-complete",
    "openIdentityVariables": [],
    "allowedVariation": "Camera, pose, and environmental detail may vary; anatomy, age, body, countable silhouette, role, and story truth may not drift."
  },
  "storyBeat": "Sable holds one precise Void working at the edge of a quiet study while another person speaks; her still attention and the nearly closed indigo wrist mark carry more weight than the phenomenon.",
  "composition": "4:5 vertical field portrait, full silhouette readable, one foreground evidence object, generous negative space for a future dossier caption outside the image.",
  "output": {
    "assetCount": 1,
    "aspectRatio": "4:5",
    "intendedSurface": "book-character-dossier-and-identity-atlas",
    "deliveryRole": "identity master candidate",
    "cropSafety": "Protect the complete subject silhouette, hands or countable limbs, and decisive evidence object from edge loss; no alternate crop is authorized by this contract.",
    "generatedTextPolicy": "no-generated-text"
  },
  "designSystem": {
    "styleMode": "adaptive-primary-pending",
    "direction": "ADAPTIVE_STYLE_PRIMARY_PENDING_AFTER_ROUND_01",
    "colorLaw": "70% ecological/material neutral, 20% identity family, 8% active phenomenon, 2% relational accent.",
    "escalation": "resonant: one localized impossible behavior; environment remains physically legible",
    "materialLaw": "Tactile, specific materials with wear, weight, construction, and local environmental response.",
    "typography": "No text, letters, logos, watermarks, borders, captions, or pseudo-glyphs inside the generated image."
  },
  "light": "Motivated directional light plus one localized Arcanean working signal; preserve skin, material, and atmospheric truth.",
  "references": {
    "sourceRefs": [
      "book/chronicles-of-arcanea/series-bible/CHARACTER_BIBLE.md#4-sable-luminaire [sha256:fabf13211046b30594f5ed927c5fea1e445219426d82dd2accabb0772e29b557]"
    ],
    "imageRefs": [],
    "imageReferencePolicy": "Use only owned or licensed references. Record file hash and role: identity, composition, material, or lighting. Never use a reference as permission to imitate its creator."
  },
  "constraints": [
    "grayscale silhouette remains identifiable",
    "face, hands, limbs, countable anatomy, age, and body proportions remain coherent",
    "visible phenomenon serves one story law",
    "adult premium editorial finish; no mascot energy",
    "series: Chronicles of Arcanea",
    "story-bible evidence outranks name-derived visual shorthand"
  ],
  "avoid": [
    "generic fantasy concept art",
    "rainbow galaxy effects",
    "permanent flame crystal or waterfall hair",
    "franchise or living-artist style imitation",
    "appropriated sacred clothing symbols gestures or shrine architecture",
    "illegible pseudo-text",
    "sexualized or childlike treatment",
    "color as the only identity signal",
    "name-derived costume or elemental shorthand unsupported by the source",
    "provisional identity traits presented as locked canon"
  ],
  "provider": {
    "adapter": "runtime-discovered",
    "preferredCapabilities": [
      "high-fidelity reference input",
      "iterative editing",
      "consistent identity",
      "generation receipt"
    ],
    "model": null,
    "seed": null,
    "providerParameters": {}
  },
  "verification": {
    "deterministicChecks": [
      "declared aspect ratio within 1.5% provider-rounding tolerance",
      "file decodes",
      "no embedded prompt text",
      "receipt and output hash recorded"
    ],
    "rubric": "arcanea_visual_quality_v1_10x5",
    "passThreshold": 42,
    "identityFloor": 4,
    "canonFloor": 4,
    "humanApprovalRequired": true
  },
  "governance": {
    "releaseEligibility": "candidate-after-human-gates",
    "sensitivityReviewRequired": false,
    "reviewRequirements": []
  },
  "contractHash": "f6cab7e39b87f5b723f66c4041d2b25c82b1577aacf4c75e594c189cc4c20f66"
}
