{
  "schema": "arcanea.visual_prompt_contract.v1",
  "intent": "Create an internal identity-discovery study of Bryda; do not present provisional traits as canonical.",
  "subject": {
    "stableId": "bryda",
    "displayName": "Bryda",
    "kind": "book-character",
    "identityLock": "Bryda is in her late thirties, broad-shouldered, and built by twenty years of hammer work; her hands and forearms are a smith’s evidence, not ornamental strength. She carries her own weight without apology and makes chains, plows, hinges, latches, and cook-pots—not magical weapons. Face, skin, hair, height, and clothing remain open.",
    "evidenceState": "source-partial",
    "openIdentityVariables": [
      "skin tone and facial structure",
      "hair color, texture, and forge-safe arrangement",
      "precise height and body proportions",
      "smith clothing, apron, and protective wear"
    ],
    "allowedVariation": "This is an identity-discovery study, not an identity master. The following variables are deliberately provisional and may be explored without being treated as canon: skin tone and facial structure; hair color, texture, and forge-safe arrangement; precise height and body proportions; smith clothing, apron, and protective wear. Only source-defined traits, role or Gate relation, evidence objects, relationship, and story beat may not drift; every variable named as open above must remain visibly provisional."
  },
  "storyBeat": "At her ordinary forge, Bryda sets down the unfinished chain and opens both work-shaped hands before choosing what her craft will no longer maintain.",
  "composition": "4:5 vertical field portrait, full silhouette readable, one foreground evidence object, generous negative space for a future dossier caption outside the image.",
  "output": {
    "assetCount": 1,
    "aspectRatio": "4:5",
    "intendedSurface": "book-character-dossier-and-identity-atlas",
    "deliveryRole": "identity discovery study — not identity master",
    "cropSafety": "Protect the complete subject silhouette, hands or countable limbs, and decisive evidence object from edge loss; no alternate crop is authorized by this contract.",
    "generatedTextPolicy": "no-generated-text"
  },
  "designSystem": {
    "styleMode": "adaptive-primary-pending",
    "direction": "ADAPTIVE_STYLE_PRIMARY_PENDING_AFTER_ROUND_01",
    "colorLaw": "70% ecological/material neutral, 20% identity family, 8% active phenomenon, 2% relational accent.",
    "escalation": "resonant: one localized impossible behavior; environment remains physically legible",
    "materialLaw": "Tactile, specific materials with wear, weight, construction, and local environmental response.",
    "typography": "No text, letters, logos, watermarks, borders, captions, or pseudo-glyphs inside the generated image."
  },
  "light": "Motivated directional light plus one localized Arcanean working signal; preserve skin, material, and atmospheric truth.",
  "references": {
    "sourceRefs": [
      "book/forge-of-ruin/BIBLE.md#bryda-halfmourning [sha256:0e6adb71693569fddd515fd84664a26a09d7deecacf04862283266857c18bb72]"
    ],
    "imageRefs": [],
    "imageReferencePolicy": "Use only owned or licensed references. Record file hash and role: identity, composition, material, or lighting. Never use a reference as permission to imitate its creator."
  },
  "constraints": [
    "grayscale silhouette remains identifiable",
    "face, hands, limbs, countable anatomy, age, and body proportions remain coherent",
    "visible phenomenon serves one story law",
    "adult premium editorial finish; no mascot energy",
    "provisional physical choices remain visibly reviewable and must never be described as locked canon",
    "series: Forge of Ruin",
    "story-bible evidence outranks name-derived visual shorthand",
    "open identity variables are hypotheses for review, never canonical facts"
  ],
  "avoid": [
    "generic fantasy concept art",
    "rainbow galaxy effects",
    "permanent flame crystal or waterfall hair",
    "franchise or living-artist style imitation",
    "appropriated sacred clothing symbols gestures or shrine architecture",
    "illegible pseudo-text",
    "sexualized or childlike treatment",
    "color as the only identity signal",
    "name-derived costume or elemental shorthand unsupported by the source",
    "provisional identity traits presented as locked canon"
  ],
  "provider": {
    "adapter": "runtime-discovered",
    "preferredCapabilities": [
      "high-fidelity reference input",
      "iterative editing",
      "consistent identity",
      "generation receipt"
    ],
    "model": null,
    "seed": null,
    "providerParameters": {}
  },
  "verification": {
    "deterministicChecks": [
      "declared aspect ratio within 1.5% provider-rounding tolerance",
      "file decodes",
      "no embedded prompt text",
      "receipt and output hash recorded"
    ],
    "rubric": "arcanea_visual_quality_v1_10x5",
    "passThreshold": 42,
    "identityFloor": 4,
    "canonFloor": 4,
    "humanApprovalRequired": true
  },
  "governance": {
    "releaseEligibility": "internal-only-until-identity-lock",
    "sensitivityReviewRequired": false,
    "reviewRequirements": []
  },
  "contractHash": "0e2322d6ea4d67e8bb8787da156c009b19c05f8573dad13693fb2c3316009a5c"
}
