{
  "schema": "arcanea.visual_prompt_contract.v1",
  "intent": "Create an internal identity-discovery study of Alera; do not present provisional traits as canonical.",
  "subject": {
    "stableId": "alera",
    "displayName": "Alera",
    "kind": "guardian",
    "identityLock": "Consequential speech embodied through composure, breath, and the willingness to remain after speaking.",
    "evidenceState": "locked-name-gate-domain-creator-proposed-behavior-physical-identity-open",
    "openIdentityVariables": [
      "embodiment type and apparent age",
      "facial structure, skin tone, hair, body proportions, and gender expression",
      "garment architecture, maintained objects, and material culture",
      "scale relative to people, architecture, and the bonded Godbeast",
      "cultural or geographic visual language, if any"
    ],
    "allowedVariation": "This is an identity-discovery study, not an identity master. The following variables are deliberately provisional and may be explored without being treated as canon: embodiment type and apparent age; facial structure, skin tone, hair, body proportions, and gender expression; garment architecture, maintained objects, and material culture; scale relative to people, architecture, and the bonded Godbeast; cultural or geographic visual language, if any. Only source-defined traits, role or Gate relation, evidence objects, relationship, and story beat may not drift; every variable named as open above must remain visibly provisional."
  },
  "storyBeat": "In the Hall of Accord, Alera speaks one unpolished sentence and stays as the resonance stone exposes the half-truths nearest to her.",
  "composition": "4:5 vertical field portrait, full silhouette readable, one foreground evidence object, generous negative space for a future dossier caption outside the image.",
  "output": {
    "assetCount": 1,
    "aspectRatio": "4:5",
    "intendedSurface": "guardian-dossier-and-identity-atlas",
    "deliveryRole": "comparative Guardian visual identity discovery plate",
    "cropSafety": "Protect the complete subject silhouette, hands or countable limbs, and decisive evidence object from edge loss; no alternate crop is authorized by this contract.",
    "generatedTextPolicy": "no-generated-text"
  },
  "designSystem": {
    "styleMode": "adaptive-primary-pending",
    "direction": "ADAPTIVE_STYLE_PRIMARY_PENDING_AFTER_ROUND_01",
    "colorLaw": "70% ecological/material neutral, 20% identity family, 8% active phenomenon, 2% relational accent.",
    "escalation": "resonant: one localized impossible behavior; environment remains physically legible",
    "materialLaw": "Tactile, specific materials with wear, weight, construction, and local environmental response.",
    "typography": "No text, letters, logos, watermarks, borders, captions, or pseudo-glyphs inside the generated image."
  },
  "light": "Motivated directional light plus one localized Arcanean working signal; preserve skin, material, and atmospheric truth.",
  "references": {
    "sourceRefs": [
      ".arcanea/lore/CANON_LOCKED.md#tier-2-the-ten-gates--arcanean-gods-locked [sha256:58c9c86fd3b540e274d478b91096523031132388b7b18b2fa1d67dee676bf54f]",
      "creator-supplied/ARCANEA_TENFOLD_CONSTITUTION_V1_0_LEVEL99.md#sha256=51ead4677134b87e35fd6ded6556dc67f9daa609313bcd9eccc74f6d94de998b (proposal-evidence-not-repo-ssot)"
    ],
    "imageRefs": [],
    "imageReferencePolicy": "Use only owned or licensed references. Record file hash and role: identity, composition, material, or lighting. Never use a reference as permission to imitate its creator."
  },
  "constraints": [
    "grayscale silhouette remains identifiable",
    "face, hands, limbs, countable anatomy, age, and body proportions remain coherent",
    "visible phenomenon serves one story law",
    "adult premium editorial finish; no mascot energy",
    "provisional physical choices remain visibly reviewable and must never be described as locked canon",
    "Gate 5: Voice; domain: Truth and expression",
    "Truth must read through breath, consequence, and staying in relation—not an open-mouth performance, sound-wave halo, singer costume, or punitive authority.",
    "divine authority reads through choice and relation, not ornamental rank",
    "physical embodiment remains provisional; this is not a canonical portrait or identity master"
  ],
  "avoid": [
    "generic fantasy concept art",
    "rainbow galaxy effects",
    "permanent flame crystal or waterfall hair",
    "franchise or living-artist style imitation",
    "appropriated sacred clothing symbols gestures or shrine architecture",
    "illegible pseudo-text",
    "sexualized or childlike treatment",
    "color as the only identity signal"
  ],
  "provider": {
    "adapter": "runtime-discovered",
    "preferredCapabilities": [
      "high-fidelity reference input",
      "iterative editing",
      "consistent identity",
      "generation receipt"
    ],
    "model": null,
    "seed": null,
    "providerParameters": {}
  },
  "verification": {
    "deterministicChecks": [
      "declared aspect ratio within 1.5% provider-rounding tolerance",
      "file decodes",
      "no embedded prompt text",
      "receipt and output hash recorded"
    ],
    "rubric": "arcanea_visual_quality_v1_10x5",
    "passThreshold": 42,
    "identityFloor": 4,
    "canonFloor": 4,
    "humanApprovalRequired": true
  },
  "governance": {
    "releaseEligibility": "internal-only-until-identity-lock",
    "sensitivityReviewRequired": false,
    "reviewRequirements": [
      "Creator selects or rejects the physical identity only after comparative silhouette, portrait, and action studies",
      "Canon review records every accepted physical trait before an identity-master contract is issued",
      "Rights and qualified cultural-origin review are required before using a human reference or culturally specific visual language"
    ]
  },
  "contractHash": "532f3ab65c4541b9dd20b6f12be82d46620296d78eace673ba8af8b210b05a01"
}
