{
  "schema": "arcanea.visual_prompt_contract.v1",
  "intent": "Create an internal identity-discovery study of Alera and Otome; do not present provisional traits as canonical.",
  "subject": {
    "stableId": "dyad-alera-otome",
    "displayName": "Alera and Otome",
    "kind": "dyad",
    "identityLock": "Consequential speech embodied through composure, breath, and the willingness to remain after speaking. Truth must read through breath, consequence, and staying in relation—not an open-mouth performance, sound-wave halo, singer costume, or punitive authority. Tested morphology candidate — the Resonance Leviathan: a non-aquatic pressure-being with no conventional whale head, one concentrated eye, and exactly five functionally distinct tuning ribs that alter pressure and architecture. The local record grounds creation-frequency resonance, truth enforcement, voice amplification, and a material correspondence that shatters near lies; its exact body remains canon-pending. The composition must show two sovereign expressions of one Gate in reciprocal consent.",
    "evidenceState": "locked-relations-local-godbeast-function-grounded-creator-proposed-behavior-and-morphology-both-identities-open",
    "openIdentityVariables": [
      "Guardian: embodiment type and apparent age",
      "Guardian: facial structure, skin tone, hair, body proportions, and gender expression",
      "Guardian: garment architecture, maintained objects, and material culture",
      "Guardian: scale relative to people, architecture, and the bonded Godbeast",
      "Guardian: cultural or geographic visual language, if any",
      "Godbeast: leviathan body plan beyond the headless thorax candidate",
      "Godbeast: single-eye placement, sensory field, and expression system",
      "Godbeast: five-rib placement, geometry, and distinct acoustic or pressure functions",
      "Godbeast: surface material, structural suspension, and non-aquatic locomotion",
      "Godbeast: absolute scale, habitat, ecology, and safe pressure boundary"
    ],
    "allowedVariation": "This is an identity-discovery study, not an identity master. The following variables are deliberately provisional and may be explored without being treated as canon: Guardian: embodiment type and apparent age; Guardian: facial structure, skin tone, hair, body proportions, and gender expression; Guardian: garment architecture, maintained objects, and material culture; Guardian: scale relative to people, architecture, and the bonded Godbeast; Guardian: cultural or geographic visual language, if any; Godbeast: leviathan body plan beyond the headless thorax candidate; Godbeast: single-eye placement, sensory field, and expression system; Godbeast: five-rib placement, geometry, and distinct acoustic or pressure functions; Godbeast: surface material, structural suspension, and non-aquatic locomotion; Godbeast: absolute scale, habitat, ecology, and safe pressure boundary. Only source-defined traits, role or Gate relation, evidence objects, relationship, and story beat may not drift; every variable named as open above must remain visibly provisional."
  },
  "storyBeat": "In the Hall of Accord, Alera speaks one unpolished sentence and stays as the resonance stone exposes the half-truths nearest to her.",
  "composition": "4:5 vertical field portrait, full silhouette readable, one foreground evidence object, generous negative space for a future dossier caption outside the image.",
  "output": {
    "assetCount": 1,
    "aspectRatio": "4:5",
    "intendedSurface": "bond-dossier-and-relationship-atlas",
    "deliveryRole": "Guardian–Godbeast relationship and identity discovery plate",
    "cropSafety": "Protect the complete subject silhouette, hands or countable limbs, and decisive evidence object from edge loss; no alternate crop is authorized by this contract.",
    "generatedTextPolicy": "no-generated-text"
  },
  "designSystem": {
    "styleMode": "adaptive-primary-pending",
    "direction": "ADAPTIVE_STYLE_PRIMARY_PENDING_AFTER_ROUND_01",
    "colorLaw": "70% ecological/material neutral, 20% identity family, 8% active phenomenon, 2% relational accent.",
    "escalation": "resonant: one localized impossible behavior; environment remains physically legible",
    "materialLaw": "Tactile, specific materials with wear, weight, construction, and local environmental response.",
    "typography": "No text, letters, logos, watermarks, borders, captions, or pseudo-glyphs inside the generated image."
  },
  "light": "Motivated directional light plus one localized Arcanean working signal; preserve skin, material, and atmospheric truth.",
  "references": {
    "sourceRefs": [
      ".arcanea/lore/CANON_LOCKED.md#tier-2-the-ten-gates--arcanean-gods-locked [sha256:58c9c86fd3b540e274d478b91096523031132388b7b18b2fa1d67dee676bf54f]",
      "creator-supplied/ARCANEA_TENFOLD_CONSTITUTION_V1_0_LEVEL99.md#sha256=51ead4677134b87e35fd6ded6556dc67f9daa609313bcd9eccc74f6d94de998b (proposal-evidence-not-repo-ssot)",
      ".arcanea/lore/godbeasts/otome.md [sha256:65ea431e9a68b37a291c3de3686a7d6c0d95b943be3e9376d021d1b59589c266]"
    ],
    "imageRefs": [],
    "imageReferencePolicy": "Use only owned or licensed references. Record file hash and role: identity, composition, material, or lighting. Never use a reference as permission to imitate its creator."
  },
  "constraints": [
    "grayscale silhouette remains identifiable",
    "both sovereign figures retain coherent faces, limbs, hands or paws, countable anatomy, and relational distance",
    "visible phenomenon serves one story law",
    "adult premium editorial finish; no mascot energy",
    "provisional physical choices remain visibly reviewable and must never be described as locked canon",
    "Gate 5: Voice",
    "exactly 5 Chords remain countable",
    "no command, riding, ownership, or obedience posture",
    "both physical identities remain provisional and cannot be promoted as canonical identities",
    "the Godbeast morphology is a controlled creator proposal under evaluation, not locked repo canon"
  ],
  "avoid": [
    "generic fantasy concept art",
    "rainbow galaxy effects",
    "permanent flame crystal or waterfall hair",
    "franchise or living-artist style imitation",
    "appropriated sacred clothing symbols gestures or shrine architecture",
    "illegible pseudo-text",
    "sexualized or childlike treatment",
    "color as the only identity signal"
  ],
  "provider": {
    "adapter": "runtime-discovered",
    "preferredCapabilities": [
      "high-fidelity reference input",
      "iterative editing",
      "consistent identity",
      "generation receipt"
    ],
    "model": null,
    "seed": null,
    "providerParameters": {}
  },
  "verification": {
    "deterministicChecks": [
      "declared aspect ratio within 1.5% provider-rounding tolerance",
      "file decodes",
      "no embedded prompt text",
      "receipt and output hash recorded"
    ],
    "rubric": "arcanea_visual_quality_v1_10x5",
    "passThreshold": 42,
    "identityFloor": 4,
    "canonFloor": 4,
    "humanApprovalRequired": true
  },
  "governance": {
    "releaseEligibility": "internal-only-until-identity-lock",
    "sensitivityReviewRequired": false,
    "reviewRequirements": [
      "Creator selects or rejects the physical identity only after comparative silhouette, portrait, and action studies",
      "Canon review records every accepted physical trait before an identity-master contract is issued",
      "Rights and qualified cultural-origin review are required before using a human reference or culturally specific visual language",
      "Creator explicitly accepts, amends, or rejects the tested morphology candidate against locked canon and the local Godbeast record",
      "Identity review records the accepted clade, Chord anatomy, limb count, face and sensory architecture, locomotion, scale, ecology, and material system before issuing a reference master",
      "Grayscale silhouette, orthographic anatomy, action, habitat, and bonded-dyad studies must agree before any public identity approval"
    ]
  },
  "contractHash": "9fd77cd8debd7f5804050ee35c6bc1b9b5109ae45ed4a691349949565b5d7854"
}
