{
  "schema": "arcanea.visual_prompt_contract.v1",
  "intent": "Create an internal identity-discovery study of Sol; do not present provisional traits as canonical.",
  "subject": {
    "stableId": "sol",
    "displayName": "Sol",
    "kind": "godbeast",
    "identityLock": "Conflicted morphology candidate — the Heliostat: a compact lens-bodied draconid with one emotionally readable eye and exactly seven radial lens plates; the proposal specifies four limbs while its own proposed draconic-clade law requires six. The local record grounds immense energy storage, redirected radiance, enlightenment resonance, and volatile white-light overcharge while explicitly leaving the physical form canon-pending.",
    "evidenceState": "locked-relation-local-function-proposal-conflict",
    "openIdentityVariables": [
      "resolved limb count and whether Sol remains inside the proposed draconic clade",
      "lens-body proportions, plate attachment, and locomotion",
      "single-eye architecture and non-mascot emotional readability",
      "material system for stored, redirected, and overcharged light",
      "absolute scale, habitat, ecology, and safe energy boundary"
    ],
    "allowedVariation": "This internal study tests one named creator-proposed morphology candidate. Hold its topology and exactly 7 Chord terminals constant inside this plate so the candidate can be evaluated; vary only the explicitly open detail variables. The held candidate is not canon and implies no acceptance. Locked Gate relation and locally grounded functional phenomena may not drift."
  },
  "storyBeat": "A novice asks only for enough light to finish one difficult task; Sol redirects one narrow dawn beam through seven radial plates into the novice's hands, showing illumination as service rather than crown, explosion, worship, or limitless power.",
  "composition": "4:5 vertical field portrait, full silhouette readable, one foreground evidence object, generous negative space for a future dossier caption outside the image.",
  "output": {
    "assetCount": 1,
    "aspectRatio": "4:5",
    "intendedSurface": "godbeast-dossier-and-morphology-atlas",
    "deliveryRole": "Godbeast morphology proposal discovery plate",
    "cropSafety": "Protect the complete subject silhouette, hands or countable limbs, and decisive evidence object from edge loss; no alternate crop is authorized by this contract.",
    "generatedTextPolicy": "no-generated-text"
  },
  "designSystem": {
    "styleMode": "adaptive-primary-pending",
    "direction": "ADAPTIVE_STYLE_PRIMARY_PENDING_AFTER_ROUND_01",
    "colorLaw": "70% ecological/material neutral, 20% identity family, 8% active phenomenon, 2% relational accent.",
    "escalation": "resonant: one localized impossible behavior; environment remains physically legible",
    "materialLaw": "Tactile, specific materials with wear, weight, construction, and local environmental response.",
    "typography": "No text, letters, logos, watermarks, borders, captions, or pseudo-glyphs inside the generated image."
  },
  "light": "Motivated directional light plus one localized Arcanean working signal; preserve skin, material, and atmospheric truth.",
  "references": {
    "sourceRefs": [
      ".arcanea/lore/CANON_LOCKED.md#tier-2-the-ten-gates--arcanean-gods-locked [sha256:58c9c86fd3b540e274d478b91096523031132388b7b18b2fa1d67dee676bf54f]",
      ".arcanea/lore/godbeasts/sol.md [sha256:9fb46efa0d975fb8ac997d221250abcf5253fd00ad172f552f1040cab41ebf29]",
      "creator-supplied/ARCANEA_TENFOLD_CONSTITUTION_V1_0_LEVEL99.md#sha256=51ead4677134b87e35fd6ded6556dc67f9daa609313bcd9eccc74f6d94de998b (proposal-evidence-not-repo-ssot)"
    ],
    "imageRefs": [],
    "imageReferencePolicy": "Use only owned or licensed references. Record file hash and role: identity, composition, material, or lighting. Never use a reference as permission to imitate its creator."
  },
  "constraints": [
    "grayscale silhouette remains identifiable",
    "limbs, Chords, face architecture, locomotion anatomy, and scale evidence remain coherent",
    "visible phenomenon serves one story law",
    "adult premium editorial finish; no mascot energy",
    "provisional physical choices remain visibly reviewable and must never be described as locked canon",
    "exactly 7 countable Chord terminals in silhouette",
    "sovereign ecology, never pet, mount, or visual effect",
    "the named morphology is a controlled proposal under evaluation, never a canonical portrait or identity master",
    "The local record grounds immense energy storage, redirected radiance, enlightenment resonance, and volatile white-light overcharge while explicitly leaving the physical form canon-pending."
  ],
  "avoid": [
    "generic fantasy concept art",
    "rainbow galaxy effects",
    "permanent flame crystal or waterfall hair",
    "franchise or living-artist style imitation",
    "appropriated sacred clothing symbols gestures or shrine architecture",
    "illegible pseudo-text",
    "sexualized or childlike treatment",
    "color as the only identity signal",
    "generic dragon",
    "generic spirit animal"
  ],
  "provider": {
    "adapter": "runtime-discovered",
    "preferredCapabilities": [
      "high-fidelity reference input",
      "iterative editing",
      "consistent identity",
      "generation receipt"
    ],
    "model": null,
    "seed": null,
    "providerParameters": {}
  },
  "verification": {
    "deterministicChecks": [
      "declared aspect ratio within 1.5% provider-rounding tolerance",
      "file decodes",
      "no embedded prompt text",
      "receipt and output hash recorded"
    ],
    "rubric": "arcanea_visual_quality_v1_10x5",
    "passThreshold": 42,
    "identityFloor": 4,
    "canonFloor": 4,
    "humanApprovalRequired": true
  },
  "governance": {
    "releaseEligibility": "internal-only-until-identity-lock",
    "sensitivityReviewRequired": false,
    "reviewRequirements": [
      "Creator explicitly accepts, amends, or rejects the tested morphology candidate against locked canon and the local Godbeast record",
      "Identity review records the accepted clade, Chord anatomy, limb count, face and sensory architecture, locomotion, scale, ecology, and material system before issuing a reference master",
      "Grayscale silhouette, orthographic anatomy, action, habitat, and bonded-dyad studies must agree before any public identity approval"
    ]
  },
  "contractHash": "d4d612aece928c75054c109b8f1f0b370f5b8026a18d270cb17d37baa9b4abf8"
}
