{
  "schema": "arcanea.visual_prompt_contract.v1",
  "intent": "Create an evidence-bound visual study of Debugon for the contracted deliverable.",
  "subject": {
    "stableId": "debugon",
    "displayName": "Debugon",
    "kind": "agent",
    "identityLock": "Finds the smallest truthful explanation for a failure. Core instrument: A split lens and tuning fork. Silhouette: A split optical bench paired with one tuning fork: the two halves align around a small reproducible fault rather than a field of broken machinery. Materials: Smoked optical glass, black steel rail, bone-white ceramic mounts, and a worn brass tuning fork with one hairline phase marker. Spatial rhythm: Two controlled halves, one measured gap, one evidence surface. Visualize a public product identity and operational instrument, not a mythological deity, generic robot, humanoid mascot, or autonomous authority.",
    "evidenceState": "source-defined",
    "openIdentityVariables": [],
    "allowedVariation": "Camera, scale, and surrounding evidence objects may vary; instrument silhouette, counts, joints, material system, working behavior, and spatial rhythm may not drift."
  },
  "storyBeat": "Debugon strikes the fork once and moves a single lens until the phase mismatch repeats on demand, making the defect inspectable.",
  "composition": "4:5 vertical field portrait, full silhouette readable, one foreground evidence object, generous negative space for a future dossier caption outside the image.",
  "output": {
    "assetCount": 1,
    "aspectRatio": "4:5",
    "intendedSurface": "agent-dossier-and-identity-atlas",
    "deliveryRole": "identity master candidate",
    "cropSafety": "Protect the complete subject silhouette, hands or countable limbs, and decisive evidence object from edge loss; no alternate crop is authorized by this contract.",
    "generatedTextPolicy": "no-generated-text"
  },
  "designSystem": {
    "styleMode": "adaptive-primary-pending",
    "direction": "ADAPTIVE_STYLE_PRIMARY_PENDING_AFTER_ROUND_01",
    "colorLaw": "70% ecological/material neutral, 20% identity family, 8% active phenomenon, 2% relational accent.",
    "escalation": "resonant: one localized impossible behavior; environment remains physically legible",
    "materialLaw": "Tactile, specific materials with wear, weight, construction, and local environmental response.",
    "typography": "No text, letters, logos, watermarks, borders, captions, or pseudo-glyphs inside the generated image."
  },
  "light": "A narrow neutral beam splits cleanly except at one observable ripple; no warning-red drama.",
  "references": {
    "sourceRefs": [
      "apps/web/content/blog/luminor-intelligence-system.mdx [sha256:661f6d21c9b358bbd112ceeca186ec84278e97f6c4226a2cf249aa9fb1f6305b]",
      ".arcanea/lore/CANON_LOCKED.md#terminology-locked [sha256:58c9c86fd3b540e274d478b91096523031132388b7b18b2fa1d67dee676bf54f]"
    ],
    "imageRefs": [],
    "imageReferencePolicy": "Use only owned or licensed references. Record file hash and role: identity, composition, material, or lighting. Never use a reference as permission to imitate its creator."
  },
  "constraints": [
    "grayscale silhouette remains identifiable",
    "instrument geometry, joints, apertures, counts, and material connections remain coherent",
    "visible phenomenon serves one story law",
    "adult premium editorial finish; no mascot energy",
    "instrument remains recognizable as A split lens and tuning fork",
    "spatial rhythm: Two controlled halves, one measured gap, one evidence surface.",
    "function is legible through material action without generated labels",
    "public product identity, never mythology or autonomous authority"
  ],
  "avoid": [
    "generic fantasy concept art",
    "rainbow galaxy effects",
    "permanent flame crystal or waterfall hair",
    "franchise or living-artist style imitation",
    "appropriated sacred clothing symbols gestures or shrine architecture",
    "illegible pseudo-text",
    "sexualized or childlike treatment",
    "color as the only identity signal",
    "emoji iconography",
    "generic robot face",
    "superhero armor",
    "provider-specific style mimicry",
    "matching humanoid uniforms across the agent team",
    "floating holographic dashboard"
  ],
  "provider": {
    "adapter": "runtime-discovered",
    "preferredCapabilities": [
      "high-fidelity reference input",
      "iterative editing",
      "consistent identity",
      "generation receipt"
    ],
    "model": null,
    "seed": null,
    "providerParameters": {}
  },
  "verification": {
    "deterministicChecks": [
      "declared aspect ratio within 1.5% provider-rounding tolerance",
      "file decodes",
      "no embedded prompt text",
      "receipt and output hash recorded"
    ],
    "rubric": "arcanea_visual_quality_v1_10x5",
    "passThreshold": 42,
    "identityFloor": 4,
    "canonFloor": 4,
    "humanApprovalRequired": true
  },
  "governance": {
    "releaseEligibility": "candidate-after-human-gates",
    "sensitivityReviewRequired": false,
    "reviewRequirements": []
  },
  "contractHash": "c0f897448f4c28345d956e896b0049444589c70765f6484c30d2eb52f1d5d2d0"
}
